{
  "$schema": "https://json-schema.org/draft/2020-12/schema",
  "$id": "https://schemas.linguum.io/translation/upstream-lock.schema.json",
  "title": "Linguum Translation Recursive Upstream Source Lock",
  "type": "object",
  "additionalProperties": false,
  "required": [
    "schemaVersion",
    "repository",
    "revision",
    "bergamotVersion",
    "sourceTreeSha256",
    "generatedAt",
    "submodules",
    "licenses"
  ],
  "properties": {
    "schemaVersion": { "const": 1 },
    "repository": { "const": "https://github.com/mozilla/translations.git" },
    "revision": { "$ref": "#/$defs/gitSha" },
    "bergamotVersion": { "type": "string", "minLength": 1 },
    "sourceTreeSha256": { "$ref": "#/$defs/sha256" },
    "generatedAt": { "type": "string", "format": "date-time" },
    "generatorRevision": { "$ref": "#/$defs/gitSha" },
    "submodules": {
      "type": "array",
      "items": {
        "type": "object",
        "additionalProperties": false,
        "required": ["path", "url", "revision", "treeSha256"],
        "properties": {
          "path": { "type": "string", "minLength": 1, "not": { "pattern": "(^|/)\\.\\.(/|$)" } },
          "url": { "type": "string", "format": "uri", "pattern": "^https://" },
          "revision": { "$ref": "#/$defs/gitSha" },
          "treeSha256": { "$ref": "#/$defs/sha256" }
        }
      }
    },
    "licenses": {
      "type": "array",
      "minItems": 1,
      "items": {
        "type": "object",
        "additionalProperties": false,
        "required": ["path", "spdx"],
        "properties": {
          "path": { "type": "string", "minLength": 1 },
          "spdx": { "type": "string", "minLength": 1 },
          "sha256": { "$ref": "#/$defs/sha256" }
        }
      }
    }
  },
  "$defs": {
    "sha256": { "type": "string", "pattern": "^[0-9a-f]{64}$" },
    "gitSha": { "type": "string", "pattern": "^[0-9a-f]{40}$" }
  }
}
