{
  "bergamotVersion": "v0.6.0",
  "generatedAt": "2026-08-20T12:53:52Z",
  "generatorRevision": "b1c8345aaecefb5781ec1d57a1132717c2d926d1",
  "licenses": [
    {
      "path": "3rd_party/extract-lex/COPYING",
      "sha256": "83a9cdbbac61c1fa33b055dafcb6f0b0aa4379d70f7c1ce15b660d1df05b4696",
      "spdx": "LGPL-2.1-only"
    },
    {
      "path": "3rd_party/fast_align/LICENSE.txt",
      "sha256": "809fa1ed21450f59827d1e9aec720bbc4b687434fa22283c6cb5dd82a47ab9c0",
      "spdx": "Apache-2.0"
    },
    {
      "path": "3rd_party/kenlm/COPYING",
      "sha256": "dc626520dcd53a22f727af3ee42c770e56c97a64fe3adb063799d8ab032fe551",
      "spdx": "LGPL-2.1-only"
    },
    {
      "path": "3rd_party/kenlm/COPYING.3",
      "sha256": "8ceb4b9ee5adedde47b31e975c1d90c73ad27b6b165a1dcd80c7c545eb65b903",
      "spdx": "GPL-3.0-only"
    },
    {
      "path": "3rd_party/kenlm/COPYING.LESSER.3",
      "sha256": "9ccf26cfe845e0eb8bb58053e47366e7ab6b697ae010f7650978d4b71b7d1fc1",
      "spdx": "LGPL-3.0-only"
    },
    {
      "path": "3rd_party/kenlm/LICENSE",
      "sha256": "6d9f8894586896ee3b383c962e141f527edeb54f561a6bd189d0eb08380c4cc2",
      "spdx": "LGPL-2.1-only"
    },
    {
      "path": "3rd_party/kenlm/util/double-conversion/LICENSE",
      "sha256": "4af93c12062c58058378de2397dc1c92bbff9ddfb1d583a01c84127557ce97ca",
      "spdx": "BSD-3-Clause"
    },
    {
      "path": "3rd_party/marian-dev/LICENSE.md",
      "sha256": "fb3e48be2f3c9c85f3acf32d4ff115a803208e51ecab694000415c8bf1dd712b",
      "spdx": "MIT"
    },
    {
      "path": "3rd_party/marian-dev/examples/LICENSE.md",
      "sha256": "58fc223092f0276625e5518d484bc9abe9b37429d827fc493f2c1a43174ff5dc",
      "spdx": "MIT"
    },
    {
      "path": "3rd_party/marian-dev/regression-tests/LICENSE.md",
      "sha256": "56206dc5d9eb4ad0060114f6ba799897ecd44f551fc1916bd32bcd38ea4d698b",
      "spdx": "MIT"
    },
    {
      "path": "3rd_party/marian-dev/src/3rd_party/CLI/LICENSE",
      "sha256": "82b1de8bd2cbd894dc9ef05854e9d8c010d0ae9f6f2dc41370bac498f9bebc7d",
      "spdx": "BSD-3-Clause"
    },
    {
      "path": "3rd_party/marian-dev/src/3rd_party/SQLiteCpp/LICENSE.txt",
      "sha256": "048bb978d3a8f5c2c271a47cc3da4ade04d95f1b5348d9f93fcb542513d8eb34",
      "spdx": "MIT"
    },
    {
      "path": "3rd_party/marian-dev/src/3rd_party/cnpy/LICENSE",
      "sha256": "1ff6fa94ad29d941ceb3bdd5ebfb260ddba4c3e962c50fb7a66c899e769de1ff",
      "spdx": "MIT"
    },
    {
      "path": "3rd_party/marian-dev/src/3rd_party/faiss/LICENSE",
      "sha256": "52412d7bc7ce4157ea628bbaacb8829e0a9cb3c58f57f99176126bc8cf2bfc85",
      "spdx": "MIT"
    },
    {
      "path": "3rd_party/marian-dev/src/3rd_party/fbgemm/LICENSE",
      "sha256": "710022ca741ddb581b589dc41493713d171b0031f0600e19feba67c7c023a9b4",
      "spdx": "BSD-3-Clause"
    },
    {
      "path": "3rd_party/marian-dev/src/3rd_party/fbgemm/third_party/asmjit/LICENSE.md",
      "sha256": "271fcd58a394f9dc97b64da172bab0f133bedbaebf6e204b0b68732ea90e5b3c",
      "spdx": "Zlib"
    },
    {
      "path": "3rd_party/marian-dev/src/3rd_party/fbgemm/third_party/cpuinfo/LICENSE",
      "sha256": "3a1fcacb580eebdadcdaa7c2041acd36e800d88dd249ea71fff1c9f116bccfd9",
      "spdx": "BSD-2-Clause"
    },
    {
      "path": "3rd_party/marian-dev/src/3rd_party/fbgemm/third_party/cpuinfo/deps/clog/LICENSE",
      "sha256": "68a14c3e79add023eecd83d611e73f05b8bf1d16852efeb7eb4033a96736da9e",
      "spdx": "BSD-2-Clause"
    },
    {
      "path": "3rd_party/marian-dev/src/3rd_party/fbgemm/third_party/googletest/LICENSE",
      "sha256": "9702de7e4117a8e2b20dafab11ffda58c198aede066406496bef670d40a22138",
      "spdx": "BSD-3-Clause"
    },
    {
      "path": "3rd_party/marian-dev/src/3rd_party/fbgemm/third_party/googletest/googlemock/LICENSE",
      "sha256": "9702de7e4117a8e2b20dafab11ffda58c198aede066406496bef670d40a22138",
      "spdx": "BSD-3-Clause"
    },
    {
      "path": "3rd_party/marian-dev/src/3rd_party/fbgemm/third_party/googletest/googlemock/scripts/generator/LICENSE",
      "sha256": "5e0df8c845c742e76f2f64d2d9ce1b7e74a2422fddbc577ae6a56319083de0bf",
      "spdx": "Apache-2.0"
    },
    {
      "path": "3rd_party/marian-dev/src/3rd_party/fbgemm/third_party/googletest/googletest/LICENSE",
      "sha256": "9702de7e4117a8e2b20dafab11ffda58c198aede066406496bef670d40a22138",
      "spdx": "BSD-3-Clause"
    },
    {
      "path": "3rd_party/marian-dev/src/3rd_party/intgemm/LICENSE",
      "sha256": "887bd367b44f548d743864cb4322d0895a36b1794c6ad5b5e3a0fac53ccd117b",
      "spdx": "BSL-1.0"
    },
    {
      "path": "3rd_party/marian-dev/src/3rd_party/intgemm/test/3rd_party/LICENSE_1_0.txt",
      "sha256": "ea056d2c64294936b226f7360c265e77c52adc4ba171ee61029357f101f439cf",
      "spdx": "BSL-1.0"
    },
    {
      "path": "3rd_party/marian-dev/src/3rd_party/mio/LICENSE",
      "sha256": "1a0fe0714e5fc17741dd880bddf445c4b3c579868df1f198f652129a9fa7c3cc",
      "spdx": "MIT"
    },
    {
      "path": "3rd_party/marian-dev/src/3rd_party/nccl/LICENSE.txt",
      "sha256": "f769fa2d363213f599366da46e2a8d650c86eaae845aec4d44b2f5fd01d4ec59",
      "spdx": "BSD-3-Clause"
    },
    {
      "path": "3rd_party/marian-dev/src/3rd_party/pathie-cpp/LICENSE",
      "sha256": "8515fc938185ff3edb2c38b60b3a2f4a92b93644502de2b73fc32d54077e2a61",
      "spdx": "BSD-2-Clause"
    },
    {
      "path": "3rd_party/marian-dev/src/3rd_party/phf/LICENSE",
      "sha256": "3f9e948dcc51aab1299dc37a53f9218bf0414c7ea24ee38e310269f74e2eef72",
      "spdx": "MIT"
    },
    {
      "path": "3rd_party/marian-dev/src/3rd_party/sentencepiece/LICENSE",
      "sha256": "cfc7749b96f63bd31c3c42b5c471bf756814053e847c10f3eb003417bc523d30",
      "spdx": "Apache-2.0"
    },
    {
      "path": "3rd_party/marian-dev/src/3rd_party/sentencepiece/third_party/absl/LICENSE",
      "sha256": "d3e2f59e1d71176dfdb555ece6a41f7a5aa0f52ff21211010ace314f57695f6b",
      "spdx": "Apache-2.0"
    },
    {
      "path": "3rd_party/marian-dev/src/3rd_party/sentencepiece/third_party/darts_clone/LICENSE",
      "sha256": "155f59997298ee336602c49f9c1110f268ac394ca2197eb02647a3555935ad52",
      "spdx": "BSD-3-Clause"
    },
    {
      "path": "3rd_party/marian-dev/src/3rd_party/sentencepiece/third_party/esaxx/LICENSE",
      "sha256": "7c28553d1d3312d65fe309f76a22ebaf33a3d76c8c1e3b98a88ee4654ecb53db",
      "spdx": "MIT"
    },
    {
      "path": "3rd_party/marian-dev/src/3rd_party/sentencepiece/third_party/protobuf-lite/LICENSE",
      "sha256": "6e5e117324afd944dcf67f36cf329843bc1a92229a8cd9bb573d7a83130fea7d",
      "spdx": "BSD-3-Clause"
    },
    {
      "path": "3rd_party/marian-dev/src/3rd_party/simple-websocket-server/LICENSE",
      "sha256": "5afa89bf6dbbe8a88b50235dc786d047a7f8c8d4142c9981197cdfa53c76bbf5",
      "spdx": "MIT"
    },
    {
      "path": "3rd_party/marian-dev/src/3rd_party/spdlog/LICENSE",
      "sha256": "9eb46fbd9cbdb0793e496ab744aa2e290b4e39825a2da5cba3ba6fa36bb25683",
      "spdx": "MIT"
    },
    {
      "path": "3rd_party/marian-dev/src/3rd_party/yaml-cpp/LICENSE",
      "sha256": "aa6fcc27be034e41e21dd832f9175bfe694a48491d9e14ff0fa278e19ad14f1b",
      "spdx": "MIT"
    },
    {
      "path": "3rd_party/marian-dev/src/3rd_party/zstr/LICENSE",
      "sha256": "f2b4ae40b0311262960b46f697497994fe35706110ac04f04b3768d9ea7df460",
      "spdx": "MIT"
    },
    {
      "path": "3rd_party/preprocess/COPYING",
      "sha256": "8ceb4b9ee5adedde47b31e975c1d90c73ad27b6b165a1dcd80c7c545eb65b903",
      "spdx": "GPL-3.0-only"
    },
    {
      "path": "3rd_party/preprocess/COPYING.LESSER",
      "sha256": "9ccf26cfe845e0eb8bb58053e47366e7ab6b697ae010f7650978d4b71b7d1fc1",
      "spdx": "LGPL-3.0-only"
    },
    {
      "path": "3rd_party/preprocess/LICENSE",
      "sha256": "e8161ba3256e9bb491e58d876e09e1feea5b2a2bf614b7e0773b3ff0b00f13c8",
      "spdx": "LGPL-3.0-only"
    },
    {
      "path": "3rd_party/preprocess/util/double-conversion/LICENSE",
      "sha256": "4af93c12062c58058378de2397dc1c92bbff9ddfb1d583a01c84127557ce97ca",
      "spdx": "BSD-3-Clause"
    },
    {
      "path": "LICENSE",
      "sha256": "1f256ecad192880510e84ad60474eab7589218784b9a50bc7ceee34c2b91f1d5",
      "spdx": "MPL-2.0"
    },
    {
      "path": "inference/3rd_party/emsdk/LICENSE",
      "sha256": "99d9a9616fbde3f5ee22a71d8645799a8522d48526130c5ba6dc27ad15ce01f1",
      "spdx": "MIT"
    },
    {
      "path": "inference/3rd_party/ssplit-cpp/LICENSE.md",
      "sha256": "4ced746a9cab1b6b6762bd6c1999c6d65e2d45de0bab19a3902514147bbff16a",
      "spdx": "Apache-2.0"
    },
    {
      "path": "inference/marian-fork/LICENSE.md",
      "sha256": "fb3e48be2f3c9c85f3acf32d4ff115a803208e51ecab694000415c8bf1dd712b",
      "spdx": "MIT"
    },
    {
      "path": "inference/marian-fork/src/3rd_party/CLI/LICENSE",
      "sha256": "82b1de8bd2cbd894dc9ef05854e9d8c010d0ae9f6f2dc41370bac498f9bebc7d",
      "spdx": "BSD-3-Clause"
    },
    {
      "path": "inference/marian-fork/src/3rd_party/cnpy/LICENSE",
      "sha256": "1ff6fa94ad29d941ceb3bdd5ebfb260ddba4c3e962c50fb7a66c899e769de1ff",
      "spdx": "MIT"
    },
    {
      "path": "inference/marian-fork/src/3rd_party/faiss/LICENSE",
      "sha256": "52412d7bc7ce4157ea628bbaacb8829e0a9cb3c58f57f99176126bc8cf2bfc85",
      "spdx": "MIT"
    },
    {
      "path": "inference/marian-fork/src/3rd_party/fbgemm/LICENSE",
      "sha256": "710022ca741ddb581b589dc41493713d171b0031f0600e19feba67c7c023a9b4",
      "spdx": "BSD-3-Clause"
    },
    {
      "path": "inference/marian-fork/src/3rd_party/fbgemm/third_party/asmjit/LICENSE.md",
      "sha256": "271fcd58a394f9dc97b64da172bab0f133bedbaebf6e204b0b68732ea90e5b3c",
      "spdx": "Zlib"
    },
    {
      "path": "inference/marian-fork/src/3rd_party/fbgemm/third_party/cpuinfo/LICENSE",
      "sha256": "3a1fcacb580eebdadcdaa7c2041acd36e800d88dd249ea71fff1c9f116bccfd9",
      "spdx": "BSD-2-Clause"
    },
    {